"Paper","Year","Venue","Task","Graph Type","Method Category","Core Problem","Main Idea","Encoder","View Generation","Positive Pair Definition","Negative Sampling","Objective","Claimed Contribution","Theoretical Analysis","Datasets","Baselines","Strongest Baseline","Metrics","Ablation","Complexity","Code Available","Weakness","Missing Experiments","Hidden Assumption","Possible Gap","Relevance Score","Evidence"
"Multi-modal Molecule Structure-text Model for Text-based Retrieval and Editing","2023","Nature Machine Intelligence","molecule-text retrieval; molecule editing; molecular property prediction","molecular graph; graph-text multimodal","graph foundation model; graph-text contrastive pretraining","分子结构和自然语言描述之间缺少统一表示，限制文本驱动的分子检索和编辑。","MoleculeSTM 对齐分子结构编码器和文本编码器，让匹配的 molecule-text pairs 在共同空间中接近。预训练表示支持文本检索分子和文本指导的分子编辑。","molecular GNN / molecule encoder; text Transformer encoder","molecule-text paired views","matched molecule-text pair","batch 中不匹配 molecule-text pairs 作为负样本。","contrastive molecule-text alignment","提出分子结构-文本多模态模型，支持文本检索和编辑。","Unknown","PubChem / molecule-text corpus; MoleculeNet-style downstream datasets","molecular GNN baselines; text/molecule retrieval baselines; molecular editing baselines","Unknown","retrieval accuracy / ranking metrics; molecular property metrics","结构编码器、文本编码器、对比预训练和编辑模块比较。","Unknown","Yes","推断：语义对齐质量依赖文本描述质量和分子-文本配对覆盖。","推断：缺少普通非分子图上的 graph-text 对齐泛化验证。","推断：文本描述能提供足够细粒度的分子结构/功能语义。","推断：将 graph-text contrastive pretraining 扩展到 citation、recommendation 或 heterophily graphs。","4","Abstract; Method section on molecule-text contrastive learning; Experiments/Ablation; official GitHub"
"GraphCLIP: Enhancing Transferability in Graph Foundation Models for Text-Attributed Graphs","2024","arXiv","node classification; transfer learning on text-attributed graphs","text-attributed graph; citation/product graph","graph foundation model; graph-text contrastive pretraining","Text-attributed graphs 中图结构和文本语义如何对齐以提升跨数据集迁移仍未充分解决。","GraphCLIP 借鉴 CLIP 思想，对齐图表示与文本表示，增强图基础模型在 text-attributed graphs 上的可迁移性。方法关注结构-文本联合表示而非单一图增强。","GNN / graph encoder; language/text encoder","graph-text paired views","matched node/graph-text pair","batch 中不匹配 graph-text pairs 作为负样本。","CLIP-style contrastive alignment","提出面向 text-attributed graphs 的 graph-text contrastive foundation model。","Unknown","text-attributed graph benchmarks as reported in paper","GNN baselines; language model baselines; graph foundation model baselines","Unknown","classification accuracy; transfer metrics","graph/text encoder、alignment loss 和迁移设置消融。","Unknown","Yes","推断：arXiv 工作，benchmark 覆盖和长期复现性仍需观察。","推断：缺少非文本属性图和异配图上是否仍有效的验证。","推断：文本语义与图结构标签语义高度一致。","推断：研究文本和结构冲突时的 graph-text contrastive learning。","4","Abstract; Method section on GraphCLIP; Experiments/Ablation; official GitHub"
"Self-supervised Graph Learning for Recommendation","2021","SIGIR","recommendation","recommendation bipartite graph; user-item graph","contrastive; augmentation-based","推荐中的 user-item 交互稀疏且有噪声，协同过滤 GNN 需要更鲁棒的自监督信号。","SGL 在 LightGCN 等推荐模型上构造多个增强视图，并最大化同一用户/物品在不同视图中的一致性。增强包括 node dropout、edge dropout 和 random walk。","LightGCN","node dropout; edge dropout; random walk","same user/item across two augmented interaction graph views","recommendation ranking 中使用负 items；contrastive loss 中 batch 内其他 user/item 为负例。","BPR loss plus InfoNCE contrastive loss","将图自监督对比学习引入推荐，提高稀疏交互场景下的鲁棒性和准确性。","有关于自监督信号和监督推荐信号互补性的分析；完整理论 Unknown。","Yelp; Amazon; Alibaba / recommendation datasets as reported","BPR; NGCF; LightGCN; Mult-VAE; graph recommendation baselines","LightGCN","Recall; NDCG","增强类型、增强强度、SSL 权重和稀疏性分组。","增加双视图训练成本；精确复杂度 Unknown。","Yes","推断：随机 dropout 是否语义保持依赖推荐图稀疏程度。","推断：缺少对曝光偏差、时间动态和冷启动文本信息的综合分析。","推断：删除部分用户-物品交互不会改变用户偏好语义。","推断：面向推荐偏差和时间演化的自适应图增强。","5","Abstract; Method section on SGL augmentations; Experiments/Ablation; official GitHub"
"Are Graph Augmentations Necessary? Simple Graph Contrastive Learning for Recommendation","2022","SIGIR","recommendation","recommendation bipartite graph; user-item graph","contrastive; augmentation-free / noise-based","推荐图中的结构增强可能不是性能提升的必要原因，甚至可能破坏协同信号。","SimGCL 不对图结构做复杂增强，而是在 embedding 表示上加入均匀噪声形成对比视图。论文强调对比学习带来的表示均匀性和推荐鲁棒性。","LightGCN","embedding perturbation / uniform noise; no structural graph augmentation","same user/item under different embedding perturbations","recommendation BPR 负采样；InfoNCE 中其他 user/item 作为负例。","BPR loss plus InfoNCE contrastive loss","质疑图结构增强必要性，提出简单噪声扰动的推荐图对比学习。","有关于 InfoNCE、alignment/uniformity 或表示分布的分析；具体以论文 theory section 为准。","Yelp; Amazon-Book; Gowalla and recommendation datasets as reported","BPR; NGCF; LightGCN; SGL; other recommendation GCL baselines","SGL / LightGCN","Recall; NDCG","噪声强度、对比权重、不同增强方式和稀疏性实验。","相比结构增强更轻量；精确复杂度 Unknown。","Yes","推断：embedding noise 缺少明确图语义解释，可能难以迁移到非推荐图。","推断：缺少动态图推荐和多行为推荐场景下的验证。","推断：小幅 embedding 扰动保持用户/物品语义并提供有效正视图。","推断：解释推荐 GCL 增益来自结构信息、噪声正则还是流行度去偏。","5","Abstract; Method section on SimGCL; Experiments/Ablation tables"
"Improving Graph Collaborative Filtering with Neighborhood-enriched Contrastive Learning","2022","WWW","recommendation","recommendation bipartite graph; user-item graph","contrastive; neighborhood-enriched","推荐图对比学习中仅用同一节点跨视图作为正样本，可能忽略结构邻居和语义邻居提供的协同信号。","NCL 同时利用 structure neighbors 和 semantic neighbors 构造 enriched positive signals。它结合 LightGCN 推荐目标和邻域增强对比目标提升 collaborative filtering。","LightGCN","structure-neighbor and semantic-neighbor views / prototypes","user/item with structural neighbors and semantic neighbors","BPR 负采样；contrastive objective 中其他 user/item 作为负例。","BPR loss plus neighborhood-enriched contrastive loss","提出将结构邻居和语义邻居纳入推荐图对比学习的 NCL。","Unknown","Gowalla; Yelp; Amazon-Book","BPR; NGCF; LightGCN; SGL; SimGCL and recommendation baselines","SGL / SimGCL depending on dataset","Recall; NDCG","结构邻居、语义邻居、prototype 数量、对比权重和稀疏性分析。","增加邻居发现或聚类成本；精确复杂度 Unknown。","Yes","推断：语义邻居选择质量依赖当前 embedding，早期训练可能不稳定。","推断：缺少在线/时间演化推荐和长尾 item 的详细机制分析。","推断：结构邻居和 embedding 近邻能提供真实偏好相似性。","推断：自适应区分有益邻居和 popularity-driven spurious neighbors。","5","Abstract; Method section on NCL; Experiments/Ablation; official GitHub"
"LightGCL: Simple Yet Effective Graph Contrastive Learning for Recommendation","2023","ICLR","recommendation","recommendation bipartite graph; user-item graph","contrastive; scalable recommendation GCL","推荐 GCL 需要在保持效果的同时降低增强和训练成本，并更好捕获全局协同模式。","LightGCL 使用 user-item interaction matrix 的 SVD 构造全局视图，并与图卷积局部视图进行对比。它将低秩全局结构纳入推荐图对比学习。","LightGCN / graph convolution with SVD-based view","SVD global view; local graph convolution view","same user/item between local graph view and SVD global view","BPR 负采样；contrastive objective 中其他 user/item 为负例。","BPR loss plus contrastive loss","提出简单有效的 SVD-based GCL 推荐框架，兼顾性能和效率。","Unknown","Gowalla; Yelp; Amazon-Book and recommendation datasets as reported","BPR; NGCF; LightGCN; SGL; SimGCL; NCL","NCL / SimGCL depending on dataset","Recall; NDCG","SVD rank、对比权重、local/global component 和复杂度比较。","论文强调轻量化和 SVD 视图效率；具体复杂度以方法/实验分析为准。","Yes","推断：SVD 低秩视图可能强化主流协同模式和 popularity bias。","推断：缺少动态图推荐和冷启动场景中 SVD 视图更新成本分析。","推断：低秩全局协同结构保留了推荐任务的核心语义。","推断：设计能抑制 popularity bias 的全局视图构造方式。","5","Abstract; Method section on LightGCL/SVD view; Experiments/Ablation; official GitHub"
"Self-Supervised Graph Transformer on Large-Scale Molecular Data","2020","NeurIPS","molecular property prediction","molecular graph","generative; molecular graph pretraining","分子属性预测缺少大规模自监督预训练框架来利用海量无标签分子。","GROVER 使用 GTransformer 架构，并在大规模分子数据上设计 atom/bond/context 等自监督任务。预训练后的模型迁移到多个分子性质预测任务。","Graph Transformer / GTransformer","masked/context molecular prediction tasks; no standard contrastive augmentation","非对比式为主；Unknown for contrastive pairs","Unknown","self-supervised atom/bond/context prediction; supervised fine-tuning","提出大规模分子图 Transformer 预训练框架 GROVER。","Unknown","large-scale molecular pretraining corpus; MoleculeNet datasets","GCN; GIN; MPNN; D-MPNN; pretraining baselines","D-MPNN / supervised molecular GNN depending on dataset","ROC-AUC; RMSE / MAE depending on molecular task","预训练任务、模型规模、数据规模和组件消融。","讨论大规模预训练设置；精确复杂度 Unknown。","Yes","推断：分子领域专用任务较强，迁移到普通图 GCL 的通用性有限。","推断：缺少与 GraphCL/GraphMAE 等后续方法的同协议比较。","推断：局部化学上下文预测能学习可迁移分子语义。","推断：结合分子结构-文本或 3D 几何的统一自监督预训练。","4","Abstract; Method section on GROVER tasks; Experiments/Ablation; official GitHub"
"Pre-training Molecular Graph Representation with 3D Geometry","2022","ICLR","molecular property prediction; transfer learning","molecular graph; 3D molecular geometry","contrastive; molecular multi-view","2D 分子图预训练忽略 3D 几何信息，而 3D 信息对许多分子性质重要。","GraphMVP 将 2D 拓扑图和 3D 几何构象作为两个视图，通过 contrastive 和 generative objectives 对齐二者。预训练模型在分子性质预测任务上迁移。","2D GNN encoder; 3D geometry encoder","2D molecular graph view; 3D geometry/conformer view","same molecule's 2D representation and 3D representation","batch 中其他 molecule 的 2D/3D 表示作为负样本。","contrastive 2D-3D alignment; generative 3D-related prediction","提出融合 2D 拓扑与 3D 几何的分子预训练框架。","Unknown","GEOM; MoleculeNet datasets; quantum chemistry/property benchmarks","GraphCL; GROVER; AttrMasking; ContextPred; supervised GNN/3D GNN baselines","GROVER / GraphCL depending on dataset","ROC-AUC; RMSE; MAE","contrastive vs generative objectives、2D/3D encoder、预训练数据和几何视图比较。","使用 3D conformer 带来额外计算/数据成本；精确复杂度 Unknown。","Yes","推断：依赖可用且质量较好的 3D 构象，普通图任务难以直接使用。","推断：缺少 3D 构象噪声和多构象不确定性对对比目标的系统分析。","推断：同一分子的 2D 与 3D 视图语义一致且互补。","推断：在非分子图中寻找可类比 3D 几何的外部语义视图。","5","Abstract; Method section on 2D-3D pretraining; Experiments/Ablation; official GitHub"
"Mole-BERT: Rethinking Pre-training Graph Neural Networks for Molecules","2023","ICLR","molecular property prediction","molecular graph","generative; contrastive; molecular pretraining","分子 GNN 预训练需要更合适的 tokenization 和语义保持任务，简单 mask atom 可能不足。","Mole-BERT 对原子环境进行离散 tokenization，并结合 masked atom prediction 和 graph-level contrastive learning。它重新设计分子预训练目标以提升迁移性能。","GIN / molecular GNN encoder","masked atom/token prediction; graph-level augmented views","same molecule across graph-level views; masked atom-token target","graph-level contrastive learning 使用 batch negatives；mask prediction 不使用 GCL 负样本。","masked atom/token prediction; graph-level contrastive loss","提出 Mole-BERT 分子图预训练框架，强调分子 tokenization 和多任务预训练。","Unknown","ZINC / large molecular corpus; MoleculeNet datasets","AttrMasking; ContextPred; GraphCL; JOAO; GROVER; GraphMVP","GraphMVP / GROVER depending on dataset","ROC-AUC; RMSE","tokenizer、mask 目标、graph contrastive loss 和预训练数据比较。","tokenizer 和预训练增加额外成本；精确复杂度 Unknown。","Yes","推断：分子 tokenization 设计领域特化，迁移到一般图不直接。","推断：缺少跨分布 scaffold split 下 token 语义稳定性的深入分析。","推断：离散 atom/environment token 能表示可迁移化学语义。","推断：为通用图学习可解释、可迁移的结构 tokenization。","4","Abstract; Method section on Mole-BERT; Experiments/Ablation; official GitHub"
"Self-supervised Representation Learning on Dynamic Graphs","2021","CIKM","dynamic prediction; temporal link prediction; node classification","temporal / dynamic graph","contrastive; dynamic graph SSL; debiased","动态图表示学习需要捕获时间演化，同时普通负采样会受动态图时间偏差影响。","DDGCL 针对动态图构造时间相关的自监督对比任务，并考虑 debiased sampling。模型学习随时间变化的节点/图表示以支持动态下游预测。","dynamic GNN / temporal graph encoder","temporal context / temporal graph views","same node or related temporal context across time/views","使用 debiased negative sampling for dynamic graphs；具体按论文方法。","dynamic graph contrastive loss","提出面向动态图的自监督表示学习框架，关注时间演化和采样偏差。","Unknown","dynamic graph datasets reported in CIKM paper","dynamic graph embedding / temporal GNN baselines; static SSL baselines","Unknown","AUC; AP; accuracy depending on task","temporal view、debiased sampling 和模型组件比较。","Unknown","Yes","推断：动态图视图和负样本定义可能强依赖时间窗口选择。","推断：缺少与后续 CLDG/DySubC 和大规模 temporal graph 方法的统一比较。","推断：时间邻近或演化上下文能定义可靠正样本。","推断：时间因果约束下的动态图对比正负样本构造。","5","Abstract; Method section on dynamic graph SSL/debiased sampling; Experiments/Ablation"
"Self-Supervised Dynamic Graph Representation Learning via Temporal Subgraph Contrast","2023","ACM TKDD","dynamic prediction; temporal link prediction; node classification","temporal / dynamic graph","contrastive; dynamic graph SSL","动态图 SSL 需要同时捕获局部结构和时间演化模式。","DySubC 使用 temporal subgraph contrast 构造动态图自监督信号，将时间子图作为上下文进行对比学习。方法关注节点/子图在时间上的结构演化一致性。","dynamic GNN / temporal graph encoder","temporal subgraph sampling","temporal subgraph-subgraph / node-temporal context pair","使用其他 temporal subgraphs 或节点上下文作为负样本；具体按论文方法。","temporal subgraph contrastive loss","提出 temporal subgraph contrast 框架用于动态图自监督表示学习。","Unknown","dynamic graph datasets reported in paper","DeepWalk/node2vec variants; dynamic graph embedding baselines; temporal GNN baselines","Unknown","AUC; AP; accuracy depending on task","subgraph sampling、时间窗口、对比损失组件和模型参数比较。","temporal subgraph sampling 带来额外成本；精确复杂度 Unknown。","Unknown","推断：子图采样策略会显著影响正负样本质量。","推断：缺少跨数据集统一 temporal split 和大规模效率评测。","推断：相近时间子图包含稳定可学习的演化语义。","推断：学习式选择 temporal subgraphs，以减少时间窗口超参数依赖。","4","Abstract; Method section on temporal subgraph contrast; Experiments/Ablation"
"CLDG: Contrastive Learning on Dynamic Graphs","2023","ICDE","dynamic prediction; temporal link prediction","temporal / dynamic graph","contrastive; dynamic graph SSL","静态图对比学习不能直接处理动态边和时间演化，需要动态图特有的视图与一致性目标。","CLDG 构造 timespan view，并利用 temporal translation invariance 约束动态表示。模型通过对比不同时间跨度的动态图视图学习稳定演化模式。","dynamic GNN / temporal graph encoder","timespan view generation; temporal graph views","same node/edge context under related timespan views","使用其他节点/时间上下文作为负样本；具体按论文方法。","contrastive loss with temporal translation invariance","提出动态图对比学习框架 CLDG，专门建模时间跨度视图。","Unknown","dynamic graph datasets reported in ICDE paper","dynamic graph embedding baselines; temporal GNN baselines; static contrastive baselines","Unknown","AUC; AP; accuracy depending on dynamic task","timespan view、temporal translation invariance、对比损失和时间窗口设置。","Unknown","Yes","推断：temporal invariance 假设可能不适合突变或周期性变化强的动态图。","推断：缺少异配动态图和大规模在线更新场景验证。","推断：相关时间跨度下的图语义应保持可对齐。","推断：面向非平稳动态图的自适应时间视图对比学习。","5","Abstract; Method section on timespan view/temporal invariance; Experiments/Ablation; official GitHub"
