"Paper","Year","Venue","Task","Graph Type","Method Category","Core Problem","Main Idea","Encoder","View Generation","Positive Pair Definition","Negative Sampling","Objective","Claimed Contribution","Theoretical Analysis","Datasets","Baselines","Strongest Baseline","Metrics","Ablation","Complexity","Code Available","Weakness","Missing Experiments","Hidden Assumption","Possible Gap","Relevance Score","Evidence"
"Augmentation-Free Self-Supervised Learning on Graphs","2022","AAAI","node classification; node clustering","homophily citation/co-purchase/co-author graph","negative-free; augmentation-free","图增强可能破坏语义且需要调参，图 SSL 需要不依赖显式增强的训练方式。","AFGRL 用在线/目标网络结构生成节点表示，并通过局部邻居和全局语义相似性选择正样本。它避免手工构造增强视图和显式负样本。","GCN","augmentation-free; positive selection from local structure and global semantics","node-neighbor / node-semantic positive pair","不使用显式负样本。","bootstrap / BYOL-style alignment objective","提出不依赖图增强的自监督图表示学习框架，并在节点任务上验证有效。","Unknown","Cora; Citeseer; PubMed; Amazon Computers; Amazon Photo; Coauthor CS; Coauthor Physics 等","DGI; GMI; MVGRL; GRACE; GCA; CCA-SSG; BGRL","GCA / CCA-SSG depending on dataset","classification accuracy; clustering metrics","local positive、global positive、predictor 和 stop-gradient 组件消融。","避免生成增强视图；精确复杂度 Unknown。","Yes","推断：正样本挖掘依赖初始结构/语义相似，可能放大错误邻居。","推断：缺少强异配图和动态图上的正样本可靠性分析。","推断：局部邻居或语义近邻大多共享对下游任务有用的标签语义。","推断：在异配图上学习可靠的 augmentation-free 正样本选择。","5","Abstract; Method section on AFGRL; Experiments/Ablation tables; official GitHub"
"Self-supervised Graph Neural Networks without explicit negative sampling","2021","WWW Workshop","node classification","homophily citation graph; general graph","negative-free","图自监督中显式负采样可能昂贵或产生 false negative，需要探索无显式负样本训练。","SelfGNN 借鉴非对比式视觉 SSL，用两个网络/视图对齐节点表示，并利用 feature augmentation 与 normalization 等机制避免坍塌。它强调无需显式负样本也能学习节点表示。","GCN / GNN encoder","feature augmentation; graph/feature perturbation depending on setting","same node across two network views","不使用显式负样本。","negative-free alignment / BYOL-SimSiam-style objective","展示无显式负采样的 GNN 自监督学习可行性。","Unknown","Cora; Citeseer; PubMed and related node classification datasets","DGI; MVGRL; supervised GCN; other SSL baselines","DGI / MVGRL depending on dataset","classification accuracy","augmentation、batch normalization / stop-gradient 等组件比较。","Unknown","Yes","推断：workshop 版本实验规模较有限，机制解释不如后续 CCA-SSG/BGRL 系统。","推断：缺少大规模图、异配图和与后续无负样本方法的比较。","推断：网络结构和 normalization 足以避免表示坍塌。","推断：系统解释图上 negative-free SSL 的防坍塌机制。","4","Abstract; Method section; Experiments section; official GitHub"
"Graph Debiased Contrastive Learning with Joint Representation Clustering","2021","IJCAI","node classification","homophily citation/co-purchase graph","contrastive; false negative / debiased","随机负采样会把潜在同类节点当作负样本，导致 graph contrastive learning 偏置。","GDCL 联合学习节点表示和聚类分配，用聚类结果估计负样本属于同类的概率。对比损失根据这种概率进行去偏，减少 false negative 的损害。","GCN","edge dropping; feature masking / graph augmentation","same node across augmented views","使用批内/全图负样本，并基于聚类估计进行 debiasing。","debiased contrastive loss with joint representation clustering","指出并缓解 GCL 中 false negative 问题，提出联合聚类去偏框架。","有去偏对比目标动机和推导；完整泛化理论 Unknown。","Cora; Citeseer; PubMed; Amazon Computers; Amazon Photo 等","DGI; GMI; MVGRL; GRACE; GCA and clustering baselines","GCA / GRACE depending on dataset","classification accuracy; clustering metrics","聚类模块、去偏项和增强策略消融。","增加聚类估计成本；精确复杂度 Unknown。","Yes","推断：聚类早期不稳定会影响去偏质量。","推断：缺少开放类别、异配图和类别极不平衡场景分析。","推断：聚类结构能近似真实语义类别，从而识别 false negative。","推断：无类别簇假设下的 false negative 检测和自适应负样本重权重。","5","Abstract; Method section on joint clustering/debiasing; Experiments/Ablation; official GitHub"
"ProGCL: Rethinking Hard Negative Mining in Graph Contrastive Learning","2022","ICML","node classification; graph classification","homophily graph; general graph","contrastive; false negative / debiased","hard negative mining 可以提升对比学习，但在图中 hard negatives 更可能包含 false negatives。","ProGCL 估计负样本为 true negative 的概率，并渐进式地将可靠 hard negatives 纳入训练。它试图避免直接强化所有 hard negatives 导致 false negative 被错误推远。","GCN / GIN depending on node-level or graph-level task","standard graph augmentations such as edge dropping and feature masking","same node/graph across augmented views","使用 hard negative mining，并通过 true-negative probability 进行渐进式重权重。","probability-aware contrastive loss / InfoNCE variant","重新分析图对比学习中的 hard negative mining，并提出区分 true/false negative 的 ProGCL。","有关于 hard negative 和 true negative 概率的目标分析。","Cora; Citeseer; PubMed; Amazon/Coauthor; graph classification datasets","GRACE; GCA; GraphCL; AD-GCL; debiased contrastive baselines","GCA / AD-GCL depending on task","classification accuracy; ROC-AUC","概率估计、渐进策略、hard negative 权重和不同基础 GCL 框架。","增加负样本概率估计成本；精确复杂度按论文分析。","Yes","推断：true-negative probability 的估计可靠性依赖当前表示质量。","推断：缺少动态图和开放世界语义变化下 false negative 的评估。","推断：相似度和训练进度可以较好地区分 true hard negatives 与 false negatives。","推断：结合结构因果或标签传播不确定性来识别 false negatives。","5","Abstract; Method/theory section on ProGCL; Experiments/Ablation tables; official GitHub"
"Generating Counterfactual Hard Negative Samples for Graph Contrastive Learning","2023","WWW","node classification","homophily graph; general graph","contrastive; false negative / debiased","GCL 需要有效 hard negatives，但直接从真实图中挖掘 hard negatives 容易混入 false negatives。","CGC 通过反事实思想生成 hard negative samples，使负样本在表示上接近但语义上应与 anchor 区分。该方式试图减少依赖随机负样本和错误 hard negatives。","GCN / GNN encoder","graph augmentations plus counterfactual negative generation","same node across graph views","使用生成的 counterfactual hard negatives；真实负样本策略按论文方法。","contrastive loss with counterfactual hard negatives","提出反事实 hard negative 生成方法以改进图对比学习。","Unknown","Cora; Citeseer; PubMed; Amazon/Coauthor-style node datasets","DGI; MVGRL; GRACE; GCA; ProGCL / hard negative baselines","ProGCL / GCA depending on dataset","classification accuracy","counterfactual generator、hard negative 数量和损失组件比较。","增加反事实样本生成成本；精确复杂度 Unknown。","Unknown","推断：生成的 hard negatives 是否真实语义相异难以无标签验证。","推断：缺少对生成负样本语义正确性的人工或标签后验分析。","推断：反事实扰动能改变语义而不只是制造表示空间噪声。","推断：用可解释约束或因果结构定义图上 counterfactual negatives。","4","Abstract; Method section on counterfactual hard negatives; Experiments/Ablation tables"
"GraphMAE: Self-Supervised Masked Graph Autoencoders","2022","KDD","node classification; graph classification; transfer learning","general graph; molecular graph","generative; masked graph autoencoder","图自监督不应只依赖对比学习和手工增强，masked autoencoding 能否成为通用图预训练范式需要验证。","GraphMAE 随机 mask 节点特征，用 GNN encoder 编码未遮蔽图，再用 decoder 重构被遮蔽节点属性。它使用 scaled cosine error 缓解特征重构难度和数值问题。","GCN; GAT; GIN depending on task","node feature masking / masked attribute reconstruction","非对比式；masked node 与原始属性之间的重构关系。","不使用显式负样本。","masked feature reconstruction; scaled cosine error","提出 GraphMAE，并展示 masked autoencoding 在节点和图任务上可与 GCL 方法竞争。","Unknown","Cora; Citeseer; PubMed; OGBN-Arxiv; PPI; ZINC / MoleculeNet; TUDataset-style graph benchmarks","DGI; MVGRL; GRACE; GCA; BGRL; GraphCL; supervised GNN","BGRL / GCA / GraphCL depending on task","accuracy; micro-F1; ROC-AUC; MAE for regression where applicable","mask ratio、decoder、loss function、encoder 类型和是否重遮蔽等。","与单视图 GNN 训练相近；精确复杂度 Unknown。","Yes","推断：重构节点属性可能偏向表面特征恢复，而非结构语义建模。","推断：缺少系统异配图和图结构掩码机制的深入比较。","推断：被 mask 节点属性可由邻域上下文预测，且该预测能力能迁移到下游任务。","推断：联合属性、结构和语义级 mask 的生成式图自监督。","5","Abstract; Section 3 GraphMAE; Experiments/Ablation tables; official GitHub"
"GraphMAE2: A Decoding-Enhanced Masked Self-Supervised Graph Learner","2023","WWW","node classification; graph classification; transfer learning","general graph; molecular graph; large-scale graph","generative; masked graph autoencoder","GraphMAE 类方法的 decoder 和重构过程仍可能不足，特别是如何强化 masked token 的语义预测。","GraphMAE2 引入 decoding-enhanced 设计，包括 re-mask decoding 和 latent representation prediction。它试图让解码器更充分利用上下文，并在更大图上验证 masked graph SSL。","GCN; GAT; GIN / GNN encoder","node feature masking; re-masking during decoding","非对比式；masked node/latent target reconstruction relation","不使用显式负样本。","masked feature reconstruction; latent prediction; scaled cosine error variant","提出增强解码的 masked graph learner，并在节点/图任务及大规模图上提升 GraphMAE。","Unknown","Cora; Citeseer; PubMed; OGBN-Arxiv; OGBN-Papers100M; graph classification / molecular datasets","GraphMAE; BGRL; CCA-SSG; GRACE; GCA; GraphCL; supervised GNN","GraphMAE / BGRL depending on task","accuracy; ROC-AUC; micro-F1","re-mask decoding、latent prediction、mask ratio、decoder depth 等。","报告大规模图实验；具体训练复杂度 Unknown。","Yes","推断：更复杂 decoder 可能带来额外训练成本和超参数敏感性。","推断：缺少异配图和结构扰动鲁棒性的系统实验。","推断：增强解码阶段的重掩码能逼迫模型学习更抽象语义而非简单复制特征。","推断：设计面向不同图类型自适应的 mask 与 decoding 策略。","5","Abstract; Method section on decoding enhancement; Experiments/Ablation tables; official GitHub"
"What's Behind the Mask: Understanding Masked Graph Modeling for Graph Autoencoders","2023","KDD","link prediction; node classification; graph representation learning","general graph; citation/co-purchase graph","generative; masked graph autoencoder","masked graph modeling 为什么有效、mask 哪些图元素更重要仍缺少系统理解。","MaskGAE 研究边/结构遮蔽与图自编码器的关系，并提出 masked graph modeling 框架。它从重构被 mask 的边或结构信息出发分析 GAE 的泛化与表示能力。","GCN / GNN encoder","edge masking; structure masking","非对比式；masked edge / structure reconstruction target","link reconstruction 中使用 non-edge negatives；不是 GCL-style 负样本。","masked edge reconstruction; graph autoencoding objective","从 masked graph modeling 角度解释和改进 GAE，提出 MaskGAE。","有，讨论 masked graph modeling 与图自编码/对比学习关系；具体结论以论文 theory section 为准。","Cora; Citeseer; PubMed; OGB datasets and link prediction benchmarks","GAE; VGAE; DGI; GRACE; GraphMAE; link prediction baselines","GraphMAE / GAE variants depending on task","AUC; AP; classification accuracy","mask ratio、mask 类型、decoder 和模型组件消融。","Unknown","Yes","推断：结构重构可能鼓励恢复观测边分布，而非学习任务相关语义。","推断：缺少动态图和异配图中结构 mask 是否有效的系统验证。","推断：被 mask 的边或结构可由剩余图上下文可靠预测。","推断：面向异配和噪声图的语义结构 mask，而非随机结构 mask。","5","Abstract; Method/theory sections on masked graph modeling; Experiments/Ablation tables; official GitHub"
"Beyond Homophily in Graph Neural Networks: Current Limitations and Effective Designs","2020","NeurIPS","node classification","heterophily graph; homophily graph","heterophily graph learning","传统 GNN 的邻居聚合假设在 heterophily 图上失效，需要识别限制并设计更适合的架构。","H2GCN 分析 ego/neighbor separation、高阶邻域和中间表示组合对异配图的重要性。模型将自节点表示与不同阶邻域表示分开处理，以避免错误平滑。","H2GCN","不构造 SSL 视图；监督/半监督异配 GNN 架构设计。","非对比式；Unknown","不使用 GCL 负样本。","supervised cross-entropy for node classification","系统指出 homophily 假设局限，并提出 H2GCN 设计原则和 benchmark 评估。","有，分析异配条件下 ego/neighbor separation 和高阶邻域的作用。","Cora; Citeseer; PubMed; Chameleon; Squirrel; Cornell; Texas; Wisconsin; Actor 等","GCN; GAT; GraphSAGE; MixHop; Geom-GCN; MLP","Geom-GCN / MixHop depending on dataset","classification accuracy","H2GCN 设计组件、高阶邻域和表示组合消融。","Unknown","Yes","推断：不是自监督/GCL 方法，主要作为异配评价和架构背景。","推断：缺少与 GCL/GraphMAE 方法的自监督预训练比较。","推断：显式分离 ego 与邻域表示可以缓解异配噪声。","推断：将异配结构原则融入 GCL 的正负样本和增强设计。","4","Abstract; Method/theory sections; Experiments tables; official GitHub"
"Geom-GCN: Geometric Graph Convolutional Networks","2020","ICLR","node classification","heterophily graph; disassortative graph","heterophily graph learning","传统基于局部邻接聚合的 GCN 难以处理结构角色相近但不直接相邻的节点关系。","Geom-GCN 先将图节点嵌入连续潜在空间，再根据几何邻域和结构角色关系进行聚合。它为异配图提供了不同于直接邻居聚合的空间视角。","Geom-GCN","不构造 SSL 视图；使用 graph embedding space 定义几何邻域。","非对比式；Unknown","不使用 GCL 负样本。","supervised cross-entropy for node classification","提出几何聚合框架，并在 heterophilous benchmarks 上展示优于传统 GCN。","Unknown","Chameleon; Squirrel; Cornell; Texas; Wisconsin; Actor; citation datasets","GCN; GAT; GraphSAGE; MixHop; GCN-Cheby; MLP","MixHop / GAT depending on dataset","classification accuracy","几何邻域、结构邻域和模型变体比较。","需要预计算或使用结构 embedding；精确复杂度 Unknown。","Yes","推断：性能可能依赖初始 graph embedding 质量和固定 split 设置。","推断：缺少自监督预训练和与现代 heterophily GNN 的全面比较。","推断：潜在几何空间能把结构/标签相关节点放近。","推断：用自监督目标学习异配图的几何视图，而非固定预嵌入。","3","Abstract; Method section; Experiments tables; official GitHub"
"Large Scale Learning on Non-Homophilous Graphs: New Benchmarks and Strong Simple Methods","2021","NeurIPS","node classification","large-scale heterophily graph","heterophily graph learning; scalable graph learning","异配图研究缺少大规模 benchmark，且许多复杂 GNN 在非同配图上并不一定优于简单方法。","论文提出大规模 non-homophilous graph benchmarks，并提出 LINKX 等简单强方法，显式结合邻接和特征信息。它指出 minibatching 和局部聚合在异配大图上有挑战。","LINKX; MLP-style adjacency and feature encoders","不构造 SSL 视图。","非对比式；Unknown","不使用 GCL 负样本。","supervised cross-entropy for node classification","提供大规模异配 benchmark，并展示简单模型在 non-homophilous graphs 上具有强竞争力。","主要为 benchmark 和方法分析；形式化理论 Unknown。","Penn94; pokec; arXiv-year; snap-patents; genius; twitch-gamers 等","GCN; GAT; GraphSAGE; MixHop; H2GCN; GPR-GNN; MLP","H2GCN / MLP / LINKX variants depending on dataset","classification accuracy; ROC-AUC for some datasets","LINKX 组件、邻接/特征分支、数据规模和 minibatching 分析。","讨论大规模训练和 minibatching 限制；LINKX 以简单 MLP 提升可扩展性。","Yes","推断：不是 SSL/GCL 方法，主要提供评价场景和强监督 baseline。","推断：缺少 GraphMAE/GCL 在这些大规模异配 benchmark 上的系统评测。","推断：在异配图上原始邻接模式和节点特征可由简单模型直接利用。","推断：构建适合大规模异配图的自监督增强和采样策略。","4","Abstract; Benchmark/method sections; Experiments tables; official GitHub"
"Beyond Smoothing: Unsupervised Graph Representation Learning with Edge Heterophily Discriminating","2023","AAAI","node classification; unsupervised node representation learning","heterophily graph","heterophily graph SSL; contrastive","无监督图表示学习常依赖平滑同配假设，在 heterophily 图中容易把不同类邻居错误拉近。","GREET 判别边的同配/异配性质，并用不同通道处理同配聚合与异配信息。它通过边异配判别和对比学习提升异配图表示。","GNN encoder with homophily/heterophily channels","edge heterophily discrimination; homophily/heterophily structural views","node-node / view-view relation guided by edge type","使用对比学习负样本；具体采样按方法部分。","contrastive objective plus edge heterophily discrimination objective","提出面向异配图的无监督表示学习框架，显式区分同配边和异配边。","Unknown","Chameleon; Squirrel; Actor; Cornell; Texas; Wisconsin; citation/co-purchase datasets","DGI; MVGRL; GRACE; GCA; BGRL; H2GCN; Geom-GCN and SSL baselines","BGRL / GCA / heterophily baselines depending on dataset","classification accuracy","edge discriminator、双通道结构、对比损失和异配组件消融。","增加边判别模块成本；精确复杂度 Unknown。","Yes","推断：边类型判别错误会直接影响后续表示学习。","推断：缺少动态图异配和大规模异配图上的效率分析。","推断：边可可靠划分为同配/异配类型，并且这种划分稳定服务下游任务。","推断：联合学习不确定边类型与自适应增强，避免硬划分带来的错误传播。","5","Abstract; Method section on edge heterophily discriminating; Experiments/Ablation; official GitHub"
"Large-Scale Representation Learning on Graphs via Bootstrapping","2022","ICLR","node classification","large-scale homophily/general graph","negative-free; scalable GCL","负样本对比学习在大图上需要大量 pairwise comparisons，训练和内存成本高。","BGRL 使用 online encoder 和 target encoder 的 bootstrapping 机制，对齐同一节点在两个增强视图中的表示。它不需要负样本，因此更适合大规模节点表示学习。","GCN; GraphSAGE / GNN encoder","edge dropping; feature masking","same node across two augmented views","不使用显式负样本。","bootstrap / BYOL-style representation alignment","提出适合大规模图的 bootstrapped graph representation learning，避免负样本复杂度。","Unknown","Cora; Citeseer; PubMed; Amazon; Coauthor; OGBN-Arxiv; large graph benchmarks","DGI; MVGRL; GRACE; GCA; CCA-SSG; supervised GNN","GCA / CCA-SSG depending on dataset","classification accuracy","target network、predictor、EMA 参数、增强类型和大规模训练设置。","强调无需负样本和 pairwise comparison，降低大规模训练成本。","Yes","推断：仍依赖随机增强语义保持，且 bootstrapping 稳定性依赖 EMA/predictor 设计。","推断：缺少异配大图和动态图上防坍塌机制验证。","推断：同一节点两种随机增强视图保持相同语义。","推断：为异配/动态图设计 scalable negative-free 图 SSL。","5","Abstract; Method section on bootstrapping; Experiments/scalability section; official GitHub"
"Inductive Representation Learning on Large Graphs","2017","NeurIPS","node classification; inductive representation learning","large-scale graph; social/citation/biological graph","scalable graph representation learning","传统 embedding 方法不能自然泛化到未见节点，大规模图也需要采样式训练。","GraphSAGE 通过采样邻居并聚合邻居特征学习归纳式节点表示。无监督版本用随机游走定义正上下文，并通过负采样训练节点相似性。","GraphSAGE","random-walk context sampling; neighborhood sampling","node-context pair from random walks","从负采样分布采样不共现节点。","unsupervised skip-gram / negative sampling loss; supervised cross-entropy","提出可归纳、可采样的大规模 GNN 框架 GraphSAGE。","Unknown","Reddit; PPI; citation data","DeepWalk; node2vec; Planetoid; supervised GCN; feature-only baselines","GCN / node2vec depending on setting","micro-F1; classification accuracy","聚合器类型、邻居采样数量和监督/无监督设置比较。","分析采样聚合使每批训练成本受采样邻居数控制。","Yes","推断：不是 GCL 方法，但其采样与负采样是 scalable GCL 的基础。","推断：缺少现代 GCL/GraphMAE 目标下的采样策略比较。","推断：采样邻域包含足够代表性的局部结构和标签信息。","推断：把 GraphSAGE 邻居采样与对比/掩码目标联合优化。","3","Abstract; Method section on sampling/aggregators; Experiments tables; official GitHub"
"GraphGPT: Graph Instruction Tuning for Large Language Models","2024","SIGIR","graph instruction following; graph question answering; node/graph reasoning","general graph; text-attributed graph","graph foundation model; graph-text pretraining","如何让 LLM 理解图结构并完成图相关指令任务。","GraphGPT 将图编码器得到的结构表示对齐到 LLM 语义空间，并构造图指令数据进行 instruction tuning。它把图结构建模和语言模型能力结合起来。","Graph neural encoder plus LLM backbone","graph-text alignment / instruction data construction; not standard graph augmentation","graph-text / graph-instruction alignment pair","Unknown","graph-text alignment; instruction tuning language modeling loss","提出面向图的 LLM instruction tuning 框架，使 LLM 具备图理解能力。","Unknown","graph instruction datasets; citation and molecule/text-attributed graph tasks as reported","LLM baselines; graph neural models; graph-language models","Unknown","accuracy; task-specific QA / classification metrics","graph encoder、alignment module、instruction data和训练阶段消融。","涉及 LLM fine-tuning 成本；精确复杂度 Unknown。","Yes","推断：图任务表现可能强依赖指令数据质量和 LLM 先验。","推断：缺少与经典 GCL 在纯结构迁移上的直接机制比较。","推断：图编码器表示可被有效投射到 LLM token/semantic space。","推断：研究 GCL 预训练如何改善 graph-to-LLM alignment 的结构可解释性。","4","Abstract; Method section on graph instruction tuning; Experiments/Ablation; official GitHub"
